{
  "schemaVersion": "1",
  "project": { "id": "verification-fixture" },
  "target": {
    "baseUrl": "http://127.0.0.1:8788",
    "allowedOrigins": ["http://127.0.0.1:8788"]
  },
  "readiness": { "scenarioRef": "ready", "timeoutMs": 5000 },
  "environments": [{
    "environmentId": "desktop",
    "viewport": { "width": 1280, "height": 800, "deviceScaleFactor": 1, "mobile": false, "touch": false },
    "locale": "ko-KR",
    "timezoneId": "Asia/Seoul",
    "colorScheme": "dark",
    "reducedMotion": true,
    "fontFingerprint": "fixture-fonts-v1"
  }],
  "scenarioCatalog": "scenarios.json",
  "baselineCatalog": "baselines.json",
  "policy": {
    "console": "rejectUnexpectedError",
    "network": "rejectUnexpectedFailure",
    "visual": "boundedEvidence",
    "externalEffects": "deny",
    "rejectSeverities": ["blocker", "major"],
    "redactions": ["fixture-secret"],
    "artifactQuota": { "maxArtifacts": 8, "maxArtifactBytes": 1048576, "maxTotalBytes": 4194304 }
  }
}
